{
  "activity_id": "a1b2c3d4-e5f6-7890-abcd-ef1234567890",
  "user": {
    "user_id": 1001,
    "username": "alice_smith",
    "email": "alice@example.com"
  },
  "action": "create",
  "resource": "PRODUCT",
  "metadata": {
    "product_id": 1001,
    "product_name": "Premium Laptop"
  },
  "timestamp": "2024-01-15T10:30:00Z",
  "ip_address": "192.168.1.100"
}

